{
  "object_type": "HUMMBL.MemorySystemRegistry",
  "schema_version": "0.1-candidate",
  "status": "PROPOSED",
  "owner": "HUMMBL, LLC",
  "decision_authority": "HUMMBL, LLC operator",
  "authoritative_artifact": "docs/memory_system_registry.candidate.json",
  "markdown_companion": "docs/MEMORY_SYSTEM_REGISTRY.md",
  "purpose": "Classify memory-related doctrine, registries, runtime surfaces, state stores, repo candidates, repositories, and archives before creating dedicated memory-* repos.",
  "evidence": {
    "observed_at": "2026-06-25T00:00:00-04:00",
    "actor": "codex",
    "host": "workstation-01",
    "commands": [
      {
        "purpose": "Verify local memory-city workspace absence",
        "workdir": "~/projects",
        "command": "test -d <local-path>/memory-city; printf 'PROJECTS/memory-city=%s\\n' \"$?\"",
        "result": "PROJECTS/memory-city=1"
      },
      {
        "purpose": "Verify local memory-civilization workspace absence",
        "workdir": "~/projects",
        "command": "test -d <local-path>/memory-civilization; printf 'PROJECTS/memory-civilization=%s\\n' \"$?\"",
        "result": "PROJECTS/memory-civilization=1"
      },
      {
        "purpose": "Search hummbl-dev GitHub org for memory/civilization/city repos",
        "workdir": "~/projects",
        "command": "gh repo list hummbl-dev --limit 200 --json name,url,isPrivate | jq -r '.[] | select(.name | test(\"memory|civilization|city\"; \"i\")) | [.name,.url,(if .isPrivate then \"private\" else \"public\" end)] | @tsv'",
        "result": "no rows"
      },
      {
        "purpose": "Search foundermode-ai GitHub org for memory/civilization/city repos",
        "workdir": "~/projects",
        "command": "gh repo list foundermode-ai --limit 200 --json name,url,isPrivate | jq -r '.[] | select(.name | test(\"memory|civilization|city\"; \"i\")) | [.name,.url,(if .isPrivate then \"private\" else \"public\" end)] | @tsv'",
        "result": "no rows"
      },
      {
        "purpose": "Verify Memory Civilization registries provenance",
        "workdir": "<local-path>/hummbl-governance",
        "command": "git log --oneline -- docs/MEMORY_CIVILIZATION_REGISTRIES.md | head -5",
        "result": "3148dd5 docs(governance): define Memory Civilization registries and Test-First Drill-Down protocol (#108)"
      }
    ]
  },
  "repo_roots": {
    "hummbl-governance": ".",
    "local-home": "../.."
  },
  "categories": [
    "doctrine",
    "registry",
    "runtime_surface",
    "state_store",
    "repo_candidate",
    "repo",
    "archive"
  ],
  "entries": [
    {
      "id": "memory_city_doctrine",
      "category": "doctrine",
      "status": "active",
      "owner": "HUMMBL, LLC",
      "write_authority": "hummbl-governance steward plus operator merge",
      "state_authority": "not a state store",
      "receipt_path": "repo review receipts when changed",
      "promotion": "not a repo by itself",
      "paths": [
        {
          "repo": "hummbl-governance",
          "path": "docs/architecture/memory-city/",
          "path_type": "directory",
          "exists_checked": true,
          "exists": false
        }
      ]
    },
    {
      "id": "canonical_surfaces_registry",
      "category": "registry",
      "status": "active",
      "owner": "Steward",
      "write_authority": "steward plus operator merge",
      "state_authority": "registry metadata only",
      "receipt_path": "repo review receipts when changed",
      "promotion": "control surface, not implementation repo",
      "paths": [
        {
          "repo": "hummbl-governance",
          "path": "docs/architecture/memory-city/doctrine/canonical-surfaces.md",
          "path_type": "file",
          "exists_checked": true,
          "exists": false
        }
      ]
    },
    {
      "id": "book_ledger",
      "category": "registry",
      "status": "proposed",
      "owner": "Steward",
      "write_authority": "steward plus operator merge",
      "state_authority": "repo docs inventory",
      "receipt_path": "hummbl-governance docs operations receipts when promoted",
      "promotion": "registry surface",
      "paths": [
        {
          "repo": "hummbl-governance",
          "path": "docs/operations/book_ledger.yaml",
          "path_type": "file",
          "exists_checked": true,
          "exists": false
        },
        {
          "repo": "hummbl-governance",
          "path": "docs/operations/BOOK_LEDGER.md",
          "path_type": "file",
          "exists_checked": true,
          "exists": false
        }
      ]
    },
    {
      "id": "memory_civilization_registries",
      "category": "registry",
      "status": "proposed",
      "owner": "HUMMBL, LLC",
      "write_authority": "hummbl-governance steward plus operator review",
      "state_authority": "registry metadata only",
      "receipt_path": "hummbl-governance review receipts",
      "promotion": "candidate governance doctrine",
      "paths": [
        {
          "repo": "hummbl-governance",
          "path": "docs/MEMORY_CIVILIZATION_REGISTRIES.md",
          "path_type": "file",
          "exists_checked": true,
          "exists": true
        }
      ]
    },
    {
      "id": "memory_system_registry",
      "category": "registry",
      "status": "proposed",
      "owner": "HUMMBL, LLC",
      "write_authority": "hummbl-governance steward plus operator review",
      "state_authority": "registry metadata only",
      "receipt_path": "hummbl-governance review receipts",
      "promotion": "candidate namespace control surface",
      "paths": [
        {
          "repo": "hummbl-governance",
          "path": "docs/MEMORY_SYSTEM_REGISTRY.md",
          "path_type": "file",
          "exists_checked": true,
          "exists": true
        },
        {
          "repo": "hummbl-governance",
          "path": "docs/memory_system_registry.candidate.json",
          "path_type": "file",
          "exists_checked": true,
          "exists": true
        }
      ]
    },
    {
      "id": "memory_kernel",
      "category": "doctrine",
      "status": "active",
      "owner": "hummbl-governance steward",
      "write_authority": "hummbl-governance steward plus operator merge",
      "state_authority": "not a state store",
      "receipt_path": "repo review receipts when changed",
      "promotion": "reference doctrine",
      "paths": [
        {
          "repo": "hummbl-governance",
          "path": "docs/reference/MEMORY_KERNEL.md",
          "path_type": "file",
          "exists_checked": true,
          "exists": false
        }
      ]
    },
    {
      "id": "memory_reconciliation_policy",
      "category": "doctrine",
      "status": "active",
      "owner": "hummbl-governance steward",
      "write_authority": "hummbl-governance steward plus operator merge",
      "state_authority": "not a state store",
      "receipt_path": "repo review receipts when changed",
      "promotion": "operations doctrine",
      "paths": [
        {
          "repo": "hummbl-governance",
          "path": "docs/operations/MEMORY_RECONCILIATION_POLICY.md",
          "path_type": "file",
          "exists_checked": true,
          "exists": false
        }
      ]
    },
    {
      "id": "data_memory_corpus_inventory",
      "category": "registry",
      "status": "active",
      "owner": "hummbl-governance steward",
      "write_authority": "hummbl-governance steward plus operator merge",
      "state_authority": "corpus inventory metadata",
      "receipt_path": "repo review receipts when changed",
      "promotion": "inventory surface",
      "paths": [
        {
          "repo": "hummbl-governance",
          "path": "docs/governance/data-memory-corpus-inventory.md",
          "path_type": "file",
          "exists_checked": true,
          "exists": false
        }
      ]
    },
    {
      "id": "memory_graph_rag_docs",
      "category": "doctrine",
      "status": "research",
      "owner": "hummbl-governance steward",
      "write_authority": "hummbl-governance steward plus operator merge",
      "state_authority": "not a state store",
      "receipt_path": "repo review receipts when changed",
      "promotion": "research material only",
      "paths": [
        {
          "repo": "hummbl-governance",
          "path": "docs/research/2026-06-07_memory-graph-rag-*.md",
          "path_type": "glob",
          "exists_checked": true,
          "exists": false
        }
      ]
    },
    {
      "id": "working_memory_modules",
      "category": "runtime_surface",
      "status": "active",
      "owner": "hummbl-governance steward",
      "write_authority": "hummbl-governance code review",
      "state_authority": "runtime-defined",
      "receipt_path": "tests and code review receipts",
      "promotion": "executable component, not standalone repo",
      "paths": [
        {
          "repo": "hummbl-governance",
          "path": "hummbl_governance/cognition/working_memory.py",
          "path_type": "file",
          "exists_checked": true,
          "exists": false
        },
        {
          "repo": "hummbl-governance",
          "path": "hummbl_governance/cognition/mcp_working_memory.py",
          "path_type": "file",
          "exists_checked": true,
          "exists": false
        }
      ]
    },
    {
      "id": "memory_manifest_script",
      "category": "runtime_surface",
      "status": "active",
      "owner": "hummbl-governance steward",
      "write_authority": "hummbl-governance code review",
      "state_authority": "inventory output only",
      "receipt_path": "tests and code review receipts",
      "promotion": "script surface",
      "paths": [
        {
          "repo": "hummbl-governance",
          "path": "hummbl_governance/scripts/memory_manifest.py",
          "path_type": "file",
          "exists_checked": true,
          "exists": false
        }
      ]
    },
    {
      "id": "memory_house_service",